{
  "schemaVersion": 1,
  "problemId": "problem-000047",
  "rightsState": "stem_public",
  "language": "zh-CN",
  "title": "丙烯醛串联反应机理",
  "number": "7",
  "examYear": 2017,
  "examStage": "final",
  "source": {
    "sourceDocumentId": "source-000012",
    "sourceLabel": "2017-31-CChO-juesai.pdf",
    "page": 0,
    "transcriptionMethod": "ocr_reviewed",
    "transcribedAt": "2026-08-08"
  },
  "provenanceNote": "由 MinerU MD(决赛/2017-31-CChO-juesai/full.md)程序化切分并整理为结构化题干;公式已尽量转为 LaTeX。经 DeepSeek 精修,修正 OCR 错字、整理公式与结构。请以官方纸质/PDF 为准。",
  "renderingHints": {
    "mhchem": true
  },
  "blocks": [
    {
      "type": "figure",
      "caption": "反应流程示意图",
      "alt": "缺失图片,请参考原题"
    }
  ],
  "parts": [
    {
      "id": "part-000047-01",
      "label": "7-1",
      "blocks": [
        {
          "type": "paragraph",
          "text": "请用反应机理解释产物 1、3、4 的生成过程,并指出关键中间体 2 的构造式。"
        }
      ]
    },
    {
      "id": "part-000047-02",
      "label": "7-2",
      "blocks": [
        {
          "type": "paragraph",
          "text": "化合物 5 在 Lewis 酸 $\\mathrm{O_3ReOSiPh_3}$ 催化下与苯甲醛反应得到化合物 6:"
        },
        {
          "type": "figure",
          "caption": "反应示意图",
          "alt": "缺失图片,请参考原题"
        },
        {
          "type": "paragraph",
          "text": "在 $\\mathrm{O_3ReOSiPh_3}$ 催化下化合物 7 转化为 $\\mathbf{8}\\ (\\mathrm{C_{14}H_{18}O_2})$,而 7 的异构体 9 则转化为 10 $(\\mathrm{C_{28}H_{36}O_4})$。"
        },
        {
          "type": "figure",
          "caption": "反应示意图",
          "alt": "缺失图片,请参考原题"
        },
        {
          "type": "paragraph",
          "text": "请画出 6、8 和 10 的构造式。"
        }
      ]
    },
    {
      "id": "part-000047-03",
      "label": "7-3",
      "blocks": [
        {
          "type": "paragraph",
          "text": "化合物 11 经下列反应生成 14:"
        },
        {
          "type": "figure",
          "caption": "反应示意图",
          "alt": "缺失图片,请参考原题"
        }
      ]
    },
    {
      "id": "part-000047-04",
      "label": "7-3-1",
      "blocks": [
        {
          "type": "paragraph",
          "text": "请画出化合物 12、14 的构造式,以及构型为 (2R,4R,6R)-14 的最稳定构象式。"
        }
      ]
    },
    {
      "id": "part-000047-05",
      "label": "7-3-2",
      "blocks": [
        {
          "type": "paragraph",
          "text": "化合物 13 如用 $\\mathrm{TiCl_4}$ 处理,则得到含氯的产物 15 $(\\mathrm{C_{15}H_{27}ClO_3})$,请画出 15 的构造式。"
        }
      ]
    },
    {
      "id": "part-000047-06",
      "label": "7-4",
      "blocks": [
        {
          "type": "paragraph",
          "text": "画出下列反应的主要产物 16 的构造式。"
        },
        {
          "type": "figure",
          "caption": "反应示意图",
          "alt": "缺失图片,请参考原题"
        }
      ]
    }
  ]
}
