{
  "schemaVersion": 1,
  "problemId": "problem-000329",
  "rightsState": "stem_public",
  "language": "zh-CN",
  "title": "金矿氰化浸出",
  "number": "1",
  "examYear": 2008,
  "examStage": "final",
  "source": {
    "sourceDocumentId": "source-000003",
    "sourceLabel": "2008-22-CChO-juesai.pdf",
    "page": 0,
    "transcriptionMethod": "ocr_reviewed",
    "transcribedAt": "2026-08-08"
  },
  "provenanceNote": "由 MinerU MD(决赛/2008-22-CChO-juesai/full.md)程序化切分并整理为结构化题干;公式已尽量转为 LaTeX。经 DeepSeek 精修。请以官方纸质/PDF 为准。",
  "renderingHints": {
    "mhchem": true
  },
  "blocks": [],
  "parts": [
    {
      "id": "part-000329-01",
      "label": "1-1",
      "blocks": [
        {
          "type": "paragraph",
          "text": "写出用氰化物溶金反应和用Zn粉置换金的化学反应方程式。"
        }
      ]
    },
    {
      "id": "part-000329-02",
      "label": "1-2",
      "blocks": [
        {
          "type": "paragraph",
          "text": "已知 $E^{\\ominus}(\\mathrm{O_2/H_2O}) = 1.229\\,\\mathrm{V}$,$E^{\\ominus}(\\mathrm{Au^+/Au}) = 1.69\\,\\mathrm{V}$,$K_a^{\\ominus}(\\mathrm{HCN}) = 4.93\\times 10^{-10}$,$\\beta_2([\\mathrm{Au(CN)_2}]^-) = 2.00\\times 10^{38}$,$F = 96485\\,\\mathrm{J\\,V^{-1}\\,mol^{-1}}$。设配制的NaCN水溶液的浓度为 $1.00\\times 10^{-3}\\,\\mathrm{mol\\,L^{-1}}$、生成的 $[\\mathrm{Au(CN)_2}]^-$ 配离子的浓度为 $1.00\\times 10^{-4}\\,\\mathrm{mol\\,L^{-1}}$、空气中 $\\mathrm{O_2}$ 的体积分数为0.210,计算298 K时在空气中溶金反应的自由能变。"
        }
      ]
    },
    {
      "id": "part-000329-03",
      "label": "1-3",
      "blocks": [
        {
          "type": "paragraph",
          "text": "当电极反应中有H+或OH−时,其电极电势E将受pH的影响,E-pH图体现了这种影响。$E\\mathrm{-pH}$ 图上有3种类型的线:电极反应的E与pH有关,为有一定斜率的直线;电极反应的E与pH无关,是一条平行于横坐标的直线;非氧化还原反应,是一条平行于纵坐标的直线。"
        },
        {
          "type": "paragraph",
          "text": "电对的 $E\\mathrm{-pH}$ 线的上方,是该电对的氧化型的稳定区,$E\\mathrm{-pH}$ 线的下方,是还原型的稳定区;位于高位置线的氧化型易与低位置线的还原型反应;各曲线的交点所处的E和pH,是各电极的氧化型和还原型共存的条件。"
        },
        {
          "type": "paragraph",
          "text": "下图是氰化法溶金过程的 $\\mathrm{Au\\!-\\!CN\\!-\\!H_2O}$ 系统的E-pH图,试借助该图对溶金反应和溶金的工艺条件进行讨论。"
        },
        {
          "type": "figure",
          "caption": "氰化法溶金过程的 Au-CN-H2O 系统的 E-pH 图(原图缺失)",
          "alt": "Au-CN-H2O 系统的 E-pH 图,显示溶金反应相关电对的电势随 pH 变化关系",
          "src": ""
        }
      ]
    }
  ]
}
