{
  "schemaVersion": 1,
  "problemId": "problem-000189",
  "rightsState": "stem_public",
  "language": "zh-CN",
  "title": "金氧化物电池热力学",
  "number": "2",
  "examYear": 2022,
  "examStage": "final",
  "source": {
    "sourceDocumentId": "source-000022",
    "sourceLabel": "2022-36-CChO-juesai-2.pdf",
    "page": 0,
    "transcriptionMethod": "ocr_reviewed",
    "transcribedAt": "2026-08-08"
  },
  "provenanceNote": "DeepSeek 精修:原题干切分失败,已清理占位信息,保留题目标题。",
  "renderingHints": {
    "mhchem": true
  },
  "blocks": [
    {
      "type": "paragraph",
      "text": "2 · 金氧化物电池热力学"
    }
  ],
  "parts": []
}
