{
  "schemaVersion": 1,
  "problemId": "problem-000025",
  "rightsState": "stem_public",
  "language": "zh-CN",
  "title": "镍钢样吸光光度测定",
  "number": "4",
  "examYear": 2016,
  "examStage": "final",
  "source": {
    "sourceDocumentId": "source-000011",
    "sourceLabel": "2016-30-CChO-juesai.pdf",
    "page": 0,
    "transcriptionMethod": "ocr_reviewed",
    "transcribedAt": "2026-08-08"
  },
  "provenanceNote": "由 MinerU MD(决赛/2016-30-CChO-juesai/full.md)程序化切分并整理为结构化题干;公式已尽量转为 LaTeX。经 DeepSeek 精修,修正 OCR 错字、整理 LaTeX 与结构。请以官方纸质/PDF 为准。",
  "renderingHints": {
    "mhchem": true
  },
  "blocks": [
    {
      "type": "paragraph",
      "text": "镍是钢中的重要元素之一,镍的加入可以增加钢的硬度、弹性、延展性和抗腐蚀性。某实验室有两份含Ni钢样,1号钢样中Ni的质量分数为0.362%,2号钢样Ni含量未知。实验人员用过二硫酸铵‒丁二酮肟吸光光度法对钢样中Ni含量进行测定:取一定质量的钢样在通风柜中加入适量硝酸,加热溶解,转移至100 mL容量瓶,定容摇匀。移取10.00 mL试样溶液于50 mL容量瓶中,依次加入酒石酸钠、NaOH、丁二酮肟和过二硫酸铵。丁二酮肟加入后有浑浊现象,加入过二硫酸铵后溶解成酒红色溶液,再加水定容。"
    }
  ],
  "parts": [
    {
      "id": "part-000025-01",
      "label": "4-1",
      "blocks": [
        {
          "type": "paragraph",
          "text": "请写出镍溶解及氧化过程中的离子方程式,并说明酒石酸钠和NaOH的作用。"
        }
      ]
    },
    {
      "id": "part-000025-02",
      "label": "4-2",
      "blocks": [
        {
          "type": "paragraph",
          "text": "1号钢样经上述分解步骤和显色反应后制备的溶液,利用普通吸光光度法进行检测。使用2 cm吸收池于530 nm处($\\varepsilon = 6.60 \\times 10^{3} \\mathrm{L\\,mol^{-1}\\,cm^{-1}}$)测量,欲使测量的相对误差最小,称取1号钢样的质量应为多少?"
        }
      ]
    },
    {
      "id": "part-000025-03",
      "label": "4-3",
      "blocks": [
        {
          "type": "paragraph",
          "text": "请指出4-2中普通吸光光度法使用的参比溶液的组成,为何使用该溶液作为参比溶液?"
        }
      ]
    },
    {
      "id": "part-000025-04",
      "label": "4-4",
      "blocks": [
        {
          "type": "paragraph",
          "text": "以示差吸光光度法测定2号钢样中Ni含量,称取0.382 g 2号钢样,经与测定1号钢样同样步骤配置的溶液,使用2 cm吸收池,波长选择530 nm,以4-2中配制的1号钢样显色反应后的溶液作参比液,并以此调节透射比为100%,此时测得2号钢样显色后溶液的透射比为 $T = 31.4\\%$,计算2号钢样中Ni的质量分数。"
        }
      ]
    }
  ]
}
