{
  "schemaVersion": 1,
  "problemId": "problem-000017",
  "rightsState": "stem_public",
  "language": "zh-CN",
  "title": "四氧化二氮二氧化氮平衡",
  "number": "6",
  "examYear": 2016,
  "examStage": "preliminary",
  "source": {
    "sourceDocumentId": "source-000050",
    "sourceLabel": "2016-30-CChO-chusai.pdf",
    "page": 0,
    "transcriptionMethod": "ocr_reviewed",
    "transcribedAt": "2026-08-08"
  },
  "provenanceNote": "由公开竞赛 PDF(2016-30-CChO-chusai)程序化切分并整理为结构化题干;经 DeepSeek 精修(OCR 错字、LaTeX、小问结构)。公式已尽量转为 LaTeX。请以官方纸质/PDF 为准。",
  "renderingHints": {
    "mhchem": true
  },
  "blocks": [],
  "parts": [
    {
      "id": "part-000017-01",
      "label": "6-1",
      "blocks": [
        {
          "type": "paragraph",
          "text": "计算 295 K 下体系达平衡时 $\\mathrm{N_2O_4}$ 和 $\\mathrm{NO_2}$ 的分压。"
        }
      ]
    },
    {
      "id": "part-000017-02",
      "label": "6-2",
      "blocks": [
        {
          "type": "paragraph",
          "text": "将上述体系温度升至 315 K,计算达平衡时 $\\mathrm{N_2O_4}$ 和 $\\mathrm{NO_2}$ 的分压。"
        }
      ]
    },
    {
      "id": "part-000017-03",
      "label": "6-3",
      "blocks": [
        {
          "type": "paragraph",
          "text": "计算恒压下体系分别在 315 K 和 295 K 达平衡时的体积比及物质的量之比。"
        }
      ]
    },
    {
      "id": "part-000017-04",
      "label": "6-4",
      "blocks": [
        {
          "type": "paragraph",
          "text": "保持恒压条件下,不断升高温度,体系中 $\\mathrm{NO_2}$ 分压最大值的理论趋近值是多少(不考虑其他反应)?根据平衡关系式给出证明。"
        }
      ]
    },
    {
      "id": "part-000017-05",
      "label": "6-5",
      "blocks": [
        {
          "type": "paragraph",
          "text": "上述体系在保持恒外压的条件下,温度从 295 K 升至 315 K,下列说法正确的是:"
        },
        {
          "type": "paragraph",
          "text": "(a)平衡向左移动 (b)平衡不移动 (c)平衡向右移动 (d)三者均有可能"
        }
      ]
    },
    {
      "id": "part-000017-06",
      "label": "6-6",
      "blocks": [
        {
          "type": "paragraph",
          "text": "与体系在恒容条件下温度从 295 K 升至 315 K 的变化相比,恒压下体系温度升高,下列说法正确的是(简述理由,不要求计算):"
        },
        {
          "type": "paragraph",
          "text": "(a)平衡移动程度更大 (b)平衡移动程度更小 (c)平衡移动程度不变 (d)三者均有可能"
        }
      ]
    }
  ]
}
