{
  "schemaVersion": 1,
  "problemId": "problem-000228",
  "rightsState": "stem_public",
  "language": "zh-CN",
  "title": "烯丙基二氮烯重排机理",
  "number": "8",
  "examYear": 2023,
  "examStage": "final",
  "source": {
    "sourceDocumentId": "source-000026",
    "sourceLabel": "2023-37-CChO-juesai-2.pdf",
    "page": 0,
    "transcriptionMethod": "ocr_reviewed",
    "transcribedAt": "2026-08-08"
  },
  "provenanceNote": "DeepSeek 精修:原题干正文自动切分失败,仅保留题目标题占位,待人工补全。",
  "renderingHints": {
    "mhchem": true
  },
  "blocks": [
    {
      "type": "paragraph",
      "text": "8 · 烯丙基二氮烯重排机理"
    }
  ],
  "parts": []
}
