{
  "schemaVersion": 1,
  "problemId": "problem-000069",
  "rightsState": "stem_public",
  "language": "zh-CN",
  "title": "化学热力学计算",
  "number": "3",
  "examYear": 2019,
  "examStage": "preliminary",
  "source": {
    "sourceDocumentId": "source-000053",
    "sourceLabel": "2019-33-CChO-chusai.pdf",
    "page": 0,
    "transcriptionMethod": "ocr_reviewed",
    "transcribedAt": "2026-08-07"
  },
  "provenanceNote": "由 MinerU MD（初赛/2019-33-CChO-chusai/full.md）程序化切分并整理为结构化题干；公式已尽量转为 LaTeX。请以官方纸质/PDF 为准。",
  "renderingHints": {
    "mhchem": true
  },
  "blocks": [
    {
      "type": "callout",
      "tone": "info",
      "text": "下列为分问。"
    }
  ],
  "parts": [
    {
      "id": "part-000069-01",
      "label": "(1)",
      "blocks": [
        {
          "type": "paragraph",
          "text": "$\\mathrm { F e O ( s ) + C O ( g )  \\ F e ( s ) + C O _ { 2 } ( g ) }$ $K _ { 1 } ^ { \\ominus } \\ = 1 . 0 0 \\ \\left( T \\ = 1 2 0 0 \\mathrm { K } \\right)$ (2) $\\mathrm { F e O ( s ) } + \\mathrm { C ( s ) }  \\mathrm { F e ( s ) } + \\mathrm { C O ( g ) }$ $K _ { 2 } ^ { \\ominus }$ (� = 1200 K)"
        },
        {
          "type": "paragraph",
          "text": "⽓体常数 $R = 8 . 3 1 4 \\mathrm { J } \\mathrm { m o l } ^ { - 1 } \\mathrm { K } ^ { - 1 }$ ；相关的热⼒学数据(298 K)列⼊下表："
        },
        {
          "type": "callout",
          "tone": "info",
          "text": "（原卷此处含表格/仪器试剂表，详见 PDF 或 MD 源文件。）"
        }
      ]
    },
    {
      "id": "part-000069-02",
      "label": "3-1",
      "blocks": [
        {
          "type": "paragraph",
          "text": "假设上述反应体系在密闭条件下达平衡时总压为1200 kPa，计算各⽓体的分压。"
        }
      ]
    },
    {
      "id": "part-000069-03",
      "label": "3-2",
      "blocks": [
        {
          "type": "paragraph",
          "text": "计算 $K _ { 2 } ^ { \\ominus }$ 。"
        }
      ]
    },
    {
      "id": "part-000069-04",
      "label": "3-3",
      "blocks": [
        {
          "type": "paragraph",
          "text": "计算 $\\mathrm { C O _ { 2 } ( g ) }$ 的标准熵 $S _ { m } ^ { \\ominus }$ （单位：J $\\mathrm { m o l ^ { - 1 } K ^ { - 1 } } )$ 。设反应的焓变和熵变不随温度变化。"
        }
      ]
    },
    {
      "id": "part-000069-05",
      "label": "3-4",
      "blocks": [
        {
          "type": "paragraph",
          "text": "反应体系中，若 $\\operatorname { C O } ( \\mathrm { g } )$ 和 $\\mathrm { C O } _ { 2 } ( \\mathrm { g ) }$ 均保持标态，判断此条件下反应的⾃发性（填写对应的字⺟）：3-4-1 反应(1)： A. ⾃发 B. 不⾃发 C. 达平衡3-4-2 反应(2)： A. ⾃发 B. 不⾃发 C. 达平衡"
        }
      ]
    },
    {
      "id": "part-000069-06",
      "label": "3-5",
      "blocks": [
        {
          "type": "paragraph",
          "text": "若升⾼温度，指出反应平衡常数如何变化（填写对应的字⺟）。3-5-1 反应(1)： A. 增⼤ B. 不变化 C. 减⼩3-5-2 反应(2)： A. 增⼤ B. 不变化 C. 减⼩"
        }
      ]
    }
  ]
}