{
  "schemaVersion": 1,
  "problemId": "problem-000316",
  "rightsState": "stem_public",
  "language": "zh-CN",
  "title": "氧化铝表面催化",
  "number": "6",
  "examYear": 2007,
  "examStage": "final",
  "source": {
    "sourceDocumentId": "source-000002",
    "sourceLabel": "2007-21-CChO-juesai.pdf",
    "page": 0,
    "transcriptionMethod": "ocr_reviewed",
    "transcribedAt": "2026-08-08"
  },
  "provenanceNote": "由 MinerU MD(决赛/2007-21-CChO-juesai/full.md)程序化切分并整理为结构化题干;公式已尽量转为 LaTeX。经 DeepSeek 精修:修正 OCR 错字、整理 LaTeX、合并空壳段落、更新渲染提示。请以官方纸质/PDF 为准。",
  "renderingHints": {
    "mhchem": true
  },
  "blocks": [
    {
      "type": "figure",
      "caption": "图1",
      "alt": "图1:氧化铝表面结构示意图(缺图)"
    },
    {
      "type": "figure",
      "caption": "图2",
      "alt": "图2:单位晶格示意图(缺图)"
    }
  ],
  "parts": [
    {
      "id": "part-000316-01",
      "label": "6-1",
      "blocks": [
        {
          "type": "paragraph",
          "text": "在C层和D层的单位晶格(即图2中的方框)内分别有几个处于由体相暴露出来的四面体空隙中的 $\\mathrm{Al^{3+}}$ 和八面体空隙中的 $\\mathrm{Al^{3+}}$?"
        }
      ]
    },
    {
      "id": "part-000316-02",
      "label": "6-2",
      "blocks": [
        {
          "type": "paragraph",
          "text": "$\\mathrm{NiO/\\gamma-Al_2O_3}$ 催化剂中分散在表面的NiO的 $\\mathrm{Ni^{2+}}$ 进入能形成表面四面体配位和八面体配位的位置,且与 $\\mathrm{Ni^{2+}}$ 相伴的 $\\mathrm{O^{2-}}$ 按 $\\gamma\\mathrm{-Al_2O_3}$ 堆积方式外延(假定只形成“单分子层”),请问在C层和D层的单位晶格中各能容纳几个 $\\mathrm{Ni^{2+}}$?"
        }
      ]
    },
    {
      "id": "part-000316-03",
      "label": "6-3",
      "blocks": [
        {
          "type": "paragraph",
          "text": "将 NiO 换为 $\\mathrm{CuO}$,文献报道 $\\mathrm{Cu^{2+}}$ 只能存在于表面的八面体空隙中,如果用氢还原不同配位环境的铜($\\mathrm{Cu^{2+}\\to Cu^{0}}$),请估计还原温度较低的表面 $\\mathrm{Cu^{2+}}$ 分布在C层还是D层中?简述理由。"
        }
      ]
    },
    {
      "id": "part-000316-04",
      "label": "6-4",
      "blocks": [
        {
          "type": "paragraph",
          "text": "已知 $\\mathrm{O^{2-}}$ 离子半径为0.140 nm,试估算 $\\mathrm{CuO/\\gamma-Al_2O_3}$ 催化剂中CuO在 $\\gamma\\mathrm{-Al_2O_3}$ 表面的最大单层分散值(以每 $100\\ \\mathrm{m^2}$ 的 $\\gamma\\mathrm{-Al_2O_3}$ 载体表面单层分散多少毫摩尔的 $\\mathrm{CuO}$ 表示)。"
        },
        {
          "type": "paragraph",
          "text": "$\\mathrm{CuO/\\gamma-Al_2O_3}$ 催化剂可以用于CO的催化氧化:$2\\mathrm{CO(g)}+\\mathrm{O_2(g)}\\to 2\\mathrm{CO_2(g)}$。若在 $p^\\ominus$、473 K 下,有 $2\\ \\mathrm{mol\\ CO(g)}$ 被完全催化氧化生成 $\\mathrm{CO_2(g)}$,请计算此过程中的反应焓变。"
        },
        {
          "type": "paragraph",
          "text": "已知298 K 下的热力学数据:$\\Delta_{\\mathrm{f}}H_{\\mathrm{m}}^\\ominus(\\mathrm{CO,g})=-110.5\\ \\mathrm{kJ\\ mol^{-1}}$,$\\Delta_{\\mathrm{f}}H_{\\mathrm{m}}^\\ominus(\\mathrm{CO_2,g})=-393.5\\ \\mathrm{kJ\\ mol^{-1}}$,在温度 $T=298\\sim500\\ \\mathrm{K}$ 范围内热容 $C_{\\mathrm{p,m}}(\\mathrm{CO,g})=29.556\\ \\mathrm{J\\ K^{-1}\\ mol^{-1}}$,$C_{\\mathrm{p,m}}(\\mathrm{O_2,g})=29.526\\ \\mathrm{J\\ K^{-1}\\ mol^{-1}}$,$C_{\\mathrm{p,m}}(\\mathrm{CO_2,g})=27.437\\ \\mathrm{J\\ K^{-1}\\ mol^{-1}}$。"
        }
      ]
    },
    {
      "id": "part-000316-05",
      "label": "6-6",
      "blocks": [
        {
          "type": "paragraph",
          "text": "CO的低温催化消除通常采用 $\\gamma\\mathrm{-Al_2O_3}$ 为载体的负载型催化剂,人们对其反应机理已经有了较深入的研究。实验结果表明,CO在催化剂表面与 $\\mathrm{O_2}$ 反应的可能历程如下:"
        },
        {
          "type": "paragraph",
          "text": "$$\n\\begin{array}{l}\n\\text{(1) CO + M} \\xleftrightarrow[k_{-1}]{k_1} \\mathrm{CO_{(ads)}} \\\\\n\\text{(2) O_2 + 2M} \\xrightarrow{k_2} 2\\mathrm{O_{(ads)}} \\\\\n\\text{(3) CO_{(ads)} + O_{(ads)}} \\xrightarrow{k_3} \\mathrm{CO_{2(ads)}} + \\mathrm{M} \\\\\n\\text{(4) CO_{2(ads)}} \\xrightarrow{k_4} \\mathrm{CO_2} + \\mathrm{M}\n\\end{array}\n$$"
        },
        {
          "type": "paragraph",
          "text": "式中M为表面活性位,在该实验条件下M的数量为定值,下标ads表示吸附态。请用稳态近似法推导其速率方程,速率用 $\\frac{\\mathrm{d}[\\mathrm{CO_2}]}{\\mathrm{d}t}$ 表示。"
        }
      ]
    }
  ]
}
