{
  "schemaVersion": 1,
  "problemId": "problem-000355",
  "rightsState": "stem_public",
  "language": "zh-CN",
  "title": "核反应与元素",
  "number": "1",
  "examYear": 2010,
  "examStage": "preliminary",
  "source": {
    "sourceDocumentId": "source-000041",
    "sourceLabel": "2010-24-CChO-chusai.pdf",
    "page": 0,
    "transcriptionMethod": "ocr_reviewed",
    "transcribedAt": "2026-08-08"
  },
  "provenanceNote": "由 MinerU MD(初赛/2010-24-CChO-chusai/full.md)程序化切分并整理为结构化题干;公式已尽量转为 LaTeX。经 DeepSeek 精修,修正 OCR 错字、整理公式与结构。请以官方纸质/PDF 为准。",
  "renderingHints": {
    "mhchem": true
  },
  "blocks": [],
  "parts": [
    {
      "id": "part-000355-01",
      "label": "1-1",
      "blocks": [
        {
          "type": "paragraph",
          "text": "2009年10月合成了第117号元素,从此填满了周期表第七周期所有空格,是元素周期系发展的一个里程碑。117号元素是用249Bk轰击 $^{48}\\mathrm{Ca}$ 靶合成的,总共得到6个117号元素的原子,其中1个原子经6次α衰变得到270Db后发生裂变;5个原子则经6次α衰变得到 $^{281}\\mathrm{Rg}$ 后发生裂变。用元素周期表上的117号元素符号,写出得到117号元素的核反应方程式(在元素符号的左上角和左下角分别标出质量数和原子序数)。"
        }
      ]
    },
    {
      "id": "part-000355-02",
      "label": "1-2",
      "blocks": [
        {
          "type": "paragraph",
          "text": "写出下列结构中中心原子的杂化轨道类型:"
        },
        {
          "type": "figure",
          "caption": "结构图(原题缺图)",
          "alt": "待补充的结构图"
        },
        {
          "type": "figure",
          "caption": "结构图(原题缺图)",
          "alt": "待补充的结构图"
        },
        {
          "type": "paragraph",
          "text": "$$[(\\mathrm{C_6H_5})\\mathrm{IF_5}]^-$$"
        },
        {
          "type": "figure",
          "caption": "结构图(原题缺图)",
          "alt": "待补充的结构图"
        },
        {
          "type": "paragraph",
          "text": "$$(\\mathrm{C_6H_5})_2\\mathrm{Xe}$$"
        },
        {
          "type": "paragraph",
          "text": "$$[\\mathrm{I}(\\mathrm{C_6H_5})_2]^+$$"
        }
      ]
    },
    {
      "id": "part-000355-03",
      "label": "1-3",
      "blocks": [
        {
          "type": "paragraph",
          "text": "一氯一溴二(氨基乙酸根)合钴(III)酸根离子有多种异构体,其中之一可用如下简式表示。请依样画出其他所有八面体构型的异构体。"
        },
        {
          "type": "figure",
          "caption": "结构图(原题缺图)",
          "alt": "待补充的结构图"
        }
      ]
    }
  ]
}
