{
  "schemaVersion": 1,
  "problemId": "problem-000133",
  "rightsState": "stem_public",
  "language": "zh-CN",
  "title": "聚合物合成与热力学",
  "number": "2",
  "examYear": 2021,
  "examStage": "preliminary",
  "source": {
    "sourceDocumentId": "source-000056",
    "sourceLabel": "2021-35-CChO-chusai-jiangsu.pdf",
    "page": 0,
    "transcriptionMethod": "ocr_reviewed",
    "transcribedAt": "2026-08-08"
  },
  "provenanceNote": "DeepSeek 精修:原题干自动切分失败,仅保留题目标题占位,待人工补全正文。",
  "renderingHints": {
    "mhchem": true
  },
  "blocks": [
    {
      "type": "paragraph",
      "text": "2 · 聚合物合成与热力学"
    }
  ],
  "parts": []
}
