{
  "schemaVersion": 1,
  "problemId": "problem-000201",
  "rightsState": "stem_public",
  "language": "zh-CN",
  "title": "铂硫多核配离子",
  "number": "4",
  "examYear": 2023,
  "examStage": "preliminary",
  "source": {
    "sourceDocumentId": "source-000060",
    "sourceLabel": "2023-37-CChO-chusai.pdf",
    "page": 0,
    "transcriptionMethod": "ocr_reviewed",
    "transcribedAt": "2026-08-07"
  },
  "provenanceNote": "由 MinerU MD（初赛/2023-37-CChO-chusai/full.md）程序化切分并整理为结构化题干；公式已尽量转为 LaTeX。请以官方纸质/PDF 为准。",
  "renderingHints": {
    "mhchem": true
  },
  "blocks": [
    {
      "type": "paragraph",
      "text": "向 $\\mathrm { H _ { 2 } P t ( O H ) } _ { \\mathfrak { c } }$ _{6}⽔溶液中加⼊⾜量的 $\\mathrm { N a _ { 2 } S _ { 2 } O _ { 3 } }$ 溶液，调整pH⾄11.4，在⾼压⽔热釜中 $1 5 0 ~ ^ { \\circ } \\mathrm { C }$ 反应 17h，得到⼀种深棕⾊的晶体(A·�H_{2}O)。A是⼀种钠盐，式量为1359.4，A的阴离⼦B是⼀种含三个Pt原⼦的多核络离⼦，仅含Pt、S、O三种元素，B中所有Pt的化学环境⼀致，配位原⼦均为S且Pt的配位数与典型的单核Pt配合物相同，存在两种化学环境不同的S，不存在Pt-Pt键和S-S键。"
    }
  ],
  "parts": [
    {
      "id": "part-000201-01",
      "label": "4-1",
      "blocks": [
        {
          "type": "paragraph",
          "text": "通过计算和分析确定络离⼦B的组成。"
        }
      ]
    },
    {
      "id": "part-000201-02",
      "label": "4-2",
      "blocks": [
        {
          "type": "paragraph",
          "text": "画出B的结构式。"
        },
        {
          "type": "heading",
          "level": 3,
          "text": "4-3 写出⽣成配合物A的化学⽅程式。"
        }
      ]
    }
  ]
}