{
  "schemaVersion": 1,
  "problemId": "problem-000354",
  "rightsState": "stem_public",
  "language": "zh-CN",
  "title": "青蒿素全合成",
  "number": "8",
  "examYear": 2009,
  "examStage": "final",
  "source": {
    "sourceDocumentId": "source-000004",
    "sourceLabel": "2009-23-CChO-juesai.pdf",
    "page": 0,
    "transcriptionMethod": "ocr_reviewed",
    "transcribedAt": "2026-08-08"
  },
  "provenanceNote": "由 MinerU MD(决赛/2009-23-CChO-juesai/full.md)程序化切分并整理为结构化题干;经 DeepSeek 精修(修正 OCR 错字、整理 LaTeX、规范小问结构)。请以官方纸质/PDF 为准。",
  "renderingHints": {
    "mhchem": true
  },
  "blocks": [
    {
      "type": "paragraph",
      "text": "我国著名有机合成化学家、中国科学院院士周维善教授在青蒿素的全合成方面做出了开创性的工作,他领导的研究小组于1983年完成了青蒿素的首次全合成。该研究组所采用的合成路线如下:"
    },
    {
      "type": "figure",
      "caption": "合成路线图(原图缺失)",
      "alt": "青蒿素全合成路线示意图"
    }
  ],
  "parts": [
    {
      "id": "part-000354-01",
      "label": "8-1",
      "blocks": [
        {
          "type": "paragraph",
          "text": "青蒿素分子中共有几个手性碳原子?写出内酯环上C-2、C-3、C-4和C-5的构型(用R/S表示)。"
        }
      ]
    },
    {
      "id": "part-000354-02",
      "label": "8-2",
      "blocks": [
        {
          "type": "paragraph",
          "text": "用系统命名法命名起始原料香茅醛和中间体A(用R/S表示其构型)。"
        }
      ]
    },
    {
      "id": "part-000354-03",
      "label": "8-3",
      "blocks": [
        {
          "type": "paragraph",
          "text": "画出中间体B、F和G的立体结构式(用楔线式表示)。"
        }
      ]
    },
    {
      "id": "part-000354-04",
      "label": "8-4",
      "blocks": [
        {
          "type": "paragraph",
          "text": "中间体C在高位阻强碱LDA存在下与3-三甲基硅基-3-丁烯-2-酮进行Michael加成反应时,除了得到中间体D之外,还产生了一种副产物,它是D的立体异构体。试画出这种副产物的立体结构式(用楔线式表示)。"
        }
      ]
    },
    {
      "id": "part-000354-05",
      "label": "8-5",
      "blocks": [
        {
          "type": "paragraph",
          "text": "写出由中间体D到中间体E转化的机理(用反应式表示)。"
        }
      ]
    }
  ]
}
