{
  "schemaVersion": 1,
  "problemId": "problem-000105",
  "rightsState": "stem_public",
  "language": "zh-CN",
  "title": "配位化学与氧化态",
  "number": "2",
  "examYear": 2020,
  "examStage": "final",
  "source": {
    "sourceDocumentId": "source-000016",
    "sourceLabel": "2020-34-CChO-juesai-2.pdf",
    "page": 0,
    "transcriptionMethod": "ocr_reviewed",
    "transcribedAt": "2026-08-07"
  },
  "provenanceNote": "未能从 MD 可靠切分正文（决赛/2020-34-CChO-juesai-1/full.md）；仅写入元数据标题占位，待人工补全。",
  "renderingHints": {
    "mhchem": true
  },
  "blocks": [
    {
      "type": "callout",
      "tone": "warn",
      "text": "本题干正文自动切分失败，仅显示题目标题占位。"
    },
    {
      "type": "paragraph",
      "text": "2 · 配位化学与氧化态"
    }
  ]
}